description,gender,encoded_gender
escape city follow sun,female,0
opps,female,0
god lover family man living eternity bible reader car lover owner style pro creator smart sink tray,male,1
easily bored amused lethal combination doesnt make lot sense even,male,1
proud washington state university alum prouder boyfriend ohheylydia personal trainer big seattle sports fan go cougs,male,1
lodi dodi likes party cfc insta notjustbailey snapchat thebailey,male,1
ceo step serve organisation runs iwill campaign believe young people change world httptcopvqvpuxgi,female,0
average guy looking chat people,male,1
periodista especializada en marketing online comercio digital chica oldtownmagazine donde escribo de todo lo que interesa,female,0
advocate architecture urban design density mass transit,male,1
im living natural high,female,0
llk ogs executiveteam dont dm,female,0
spiritualist theosophist supporter religion freedom believe mouthy atheists blocked,male,1
cause ive thinking bout forever,female,0
love one another intensely pure heart hardinsimmons baseball,male,1
trauma center rpmv im real brains caduceus rest idiots bio httptconyfbxftq assisted lab fallenzerach,male,1
fave taking nap k gold crown still head would like one two sugars tea dear,female,0
vp operations coowner httptcoocmctkr business connoisseursports film savantgentleman lesuire,male,1
youngin tranna make hood using tools god gave adaptandovercome,male,1
falcons nation proverbs gods dead hockeytown boiiii,male,1
favs markiplier jacksepticeye stevoptweets bubblebutt c markipliershero septicarmy meowipliersquad dayyss x,male,1
enter something cool thought provoking,male,1
yrs old married yrs got sons zack owen xander love wwerohtna ok hhh best wrestler ever kevin owens future world champ,female,0
otrapink grades c c caca disgusting,male,1
independent video game developer personal account represent views employer read risk fun,male,1
chrisworld longlivetellz teamfreepac,male,1
go hang salami im lasagna hog,male,1
like heaven,female,0
thats spirit oliver sykes bring horizon oliver scott sykes gran amor eterno feel heart true friends,male,1
new music ddk money ft solidstar prod popito httptcoartwoalsk booking youngddkgmailcom,male,1
novelist blogger pethead social worker exnight kite gardening stops life getting rocknroll writes httptcokiehfmvvhj views,male,1
im girl trying get life one day time,female,0
im saving energy move airspace,male,1
spent lot time standing front microwave im,male,1
writer html design animal rights activist taiji volunteer orca protector seasheperd tweettaijii dolphinproject photo filming,male,1
professional photographer amateur everything else,male,1
one day youre seventeen planning someday quietly without ever really noticing someday today,female,0
think someday well buried side side feet matching coffins lifeless bodies rotting together eternity,female,0
watever,female,0
christian conservative upright girl w wayward bend responsible dreamer careless perfectionist churchgoing clubhopper authentic hypocrite,female,0
like buisness,male,1
child god,female,0
columbia english poli sci prelaw editor cpreviewonline editor culr officer cu scholars alliance writer upennpulj milk aficionado,female,0
defender secular spaces feminist sometimes writer sometimes reader,female,0
happy worse,male,1
follower jesus christ lover life people enfp starbucks partner,female,0
follow bliss make money squats squats,female,0
nothing see,female,0
dad husband advertising professional bodybuilder,male,1
pues nada solamente jazmn en tus sueos por siempre sigues te sigo rain,female,0
owner allergyfree glutenfree vegan sugarfree bakery sweet debbies organic cupcakes creator mouthwatering savory plantbased recipes,female,0
pandoran con artist turned vault hunter fulltime hyperion loather wanted least sixtytwo cities posttftb,female,0
guy without httptconlfpnywxs medical marijuana proponentveteranvietnam erahttptcodtqnfrgpoppop,male,1
god family friends ccc basketball,male,1
brazilian puerto rican black white capricorn im senior college uf tb,female,0
even night changes never change love one direction,male,1
african princess jamaican prince mickymousey sc imtupacin,female,0
humanity first priority adventures traveling tourist photography sports love nature live nature wish peaceful world sale,male,1
writerproducercreatororacle delivery leaderspeakingfreelyleadinginnovationnextoprahorstevejobs,female,0
feminism books tv shows allison argent superheroes delena peyton sawyer halsey cersei lannister raven cycle octavia blake christin,female,0
instagram briannaamurray,female,0
snore janet real name nonbinary lass shetheyeyyour fave nb pronoun esperanta konto jen hundstabejo,female,0
name stephanie n fountain im better known nikkoleon im silly artist likes many things little much free time c,female,0
thick thighs thin patience xx til die mel gf,female,0
im simple girl huge passion yarn ive opened online store please check also fighting endometriosis spreading awareness,female,0
awkward specialty like singing cats anime kdrama kpop metal sushi tumblr nintendo ptx pansexual demigirl sheher theythem,female,0
cheerful energetic thats real always keep support anime,female,0
partner financial risk management sydney australia,male,1
award winning singersongwritermodelactor book rickyjaybookinggmailcom press prrickyjarmancomi choose followback cuz every deserves feel important,male,1
never blame day life good days give happiness bad days give experience worst days give lesson staunch man utd ninja,male,1
ok,female,0
dont follow dont even know im going,female,0
new account chilled laidback musiclife short law student tomboy heartweird p,female,0
couldnt,male,1
select parts holladay im kind big deal,male,1
fat sad,female,0
youre fucking amazing person,male,1
essayist writing coach healer forever traveler empowering writers intuitive souls create inspired work fullest potential,female,0
bookings hit httpstcocbphy,male,1
huge northwich fan belfastgiants fan,female,0
independent chartered insurance broker taunton somerset advise businesses charities across south west beyond tweets pistonbroker,male,1
commercial director zignia live member board water happiness,male,1
ig dianaanicholee vine dianaanicholee,female,0
instagram kenz,female,0
guess weve daddy,male,1
born selenator,female,0
nothing happen swing bat,male,1
im fluent sarcasm,female,0
christian conservative texan news junkie teaparty crinsider,male,1
head heart strong,female,0
critically acclaimed playwright almost unsigned rapper freelance journalist,male,1
reporter globalnb covering nb legislature impacts stu jschool grad rural pei reweets endorsements,female,0
managing editor httptcoinfatttcx georgia southern eagles contributor httptcodowstdxzc scotch drinker cigar smoker loving life plains,male,1
capricorn future sc teelatoya ig teelatoyaa r,female,0
ljworld crime courts reporter kujournalism alumna writer lights sirens crime blog httptcomhucirpq,female,0
lukesaibum im eating halloween cookie,male,1
living dementia alzheimers suffering may enough time left see world without dementia hope see one accepts,male,1
mediapr pro talk talksportscotlandtonight bbcradioscot bfbs dep ed glasgow publications read hm queen kylie usain sarcasm irony,male,1
visit blog lifestyle living well want share journey creating living well lifestyle well help encourage,female,0
instagram onekeys snapchat onekeysgh email gnsafoahhotmailcom,male,1
lly wlly,female,0
bonniejean alford author artist actress shes founder creative communication specialist alford enterprises specialty communication firm,female,0
old school seguidor de las tres f feo fuerte formal el one piece lo tengo yo bendecida fue la causa de mi fortuna,male,1
dm pics ur dogs,female,0
corinthians clemson university alum,female,0
fucc feelings,female,0
gangster cutie viva mexico male bad ass mexican god forgives furry balls plopped menacingly table inc soutpark mexicano xiii idgaf,male,1
im asshole love dxpressedgee,male,1
traveling boots dancing shoes,female,0
im husband leah father gabby claire caleb im also founder citylife church philadelphia,male,1
currently listening sgfg crying,male,1
tomintoul distillery snapchat begey nicoleaimeep,male,1
im allergic cheatin hate failure love achievement,male,1
hes kinda beautiful,female,0
hey assbutt,male,1
mature transvestite living sticks lonely need friends tvchix,male,1
internist medical educator doctors trainings usmle step step ck step review courses drintraining httptcoccnohq,male,1
reporter keyetv former border reporter rgv maybornunt grad dallas native opinions expressed,female,0
